{
  "protocolVersion": "1.0",
  "taskId": "0199b861-cc3c-7a8e-a915-e5dbff3af7ab",
  "attemptId": "0199b862-1025-78be-bd71-c6969b74ab72",
  "idempotencyKey": "compute:0199b861-cc3c-7a8e-a915-e5dbff3af7ab:1",
  "requestFingerprint": "a468a2c12f7c20ab72d2085b75d51c0b97d884c98a2889db8411f561e6253f5d",
  "task": {
    "type": "audio.align",
    "schemaVersion": "1.0"
  },
  "model": {
    "executor": "whisperx",
    "model": "large-v3",
    "revision": "3.8.6"
  },
  "constraints": {
    "deadline": "2026-09-14T12:00:00Z",
    "maxRuntimeSeconds": 1800
  },
  "inputs": {
    "script": "Một đoạn lời kể.",
    "language": "vi",
    "audioArtifactRole": "source-audio"
  },
  "artifacts": {
    "inputs": [
      {
        "artifactId": "0199b86a-6db8-75b8-bd98-78442a0177dd",
        "role": "source-audio",
        "mediaType": "audio/wav",
        "sizeBytes": 382144,
        "sha256": "250c80c0f808234c12876f8f38e4ea6b658b3bc2c9c98b2d55e302324e9ac945",
        "access": {
          "method": "GET",
          "url": "https://artifact.invalid/opaque-input",
          "expiresAt": "2026-09-14T12:15:00Z",
          "headers": {}
        }
      }
    ],
    "outputs": []
  }
}
